"Majcher I.","57211937891;","The Schengen-wide entry ban: how are non-citizens’ personal data protected?",2020,"Journal of Ethnic and Migration Studies",,,,"","",,3,"10.1080/1369183X.2020.1796279","https://www.scopus.com/inward/record.uri?eid=2-s2.0-85089981686&doi=10.1080%2f1369183X.2020.1796279&partnerID=40&md5=62e0e25fcb87b869b9472c4c132e5037","European Council on Refugees and Exiles (ECRE), Brussels, Belgium","Majcher, I., European Council on Refugees and Exiles (ECRE), Brussels, Belgium","The article addresses the Schengen-wide entry ban, which is one of the key measures laid down in the EU Returns Directive (2008/115/EC). The entry ban entails that a non-citizen expelled from one member state is barred from returning to the whole Schengen area for up to five years, or longer in case of a threat to public policy or national security. The pan-European validity of the entry ban is ensured by an alert entered in the Schengen Information System (SIS). The alert is a set of personal data registered in the SIS which states may process to identify the person with a view of the refusal of entry. Processing personal data of non-citizens may pose a challenge to the protection of their data. The article assesses data protection rules laid down in the SIS Regulation (Regulation 1987/2006) and the Regulation which will replace it (Regulation 2018/1861). As it argues, SIS-specific data protection safeguards are frequently narrower than rules under data protection law, including the General Data Protection Regulation and Council of Europe Convention 108, and fall short of requirements flowing from the right to privacy under the European Convention of Human Rights and EU Charter of Fundamental Rights. © 2020 Informa UK Limited, trading as Taylor & Francis Group.","Data protection; entry ban; Returns Directive; right to privacy; Schengen Information System (SIS)",,"Majcher, I.; European Council on Refugees and Exiles (ECRE)Belgium; email: izabella.majcher@graduateinstitute.ch",,"Routledge",1369183X,,,,"English","J. Ethn. Migr. Stud.",Article,"Article in Press","",Scopus,2-s2.0-85089981686
"Inshakova A.O., Inshakova E.I., Deryugina T.V.","56185976100;57191255542;57200075772;","Information technologies for the formation of the european space of freedom, security and justice",2020,"Advances in Intelligent Systems and Computing","1100 AISC",,,"444","453",,1,"10.1007/978-3-030-39319-9_51","https://www.scopus.com/inward/record.uri?eid=2-s2.0-85081663037&doi=10.1007%2f978-3-030-39319-9_51&partnerID=40&md5=2c033dac8f192d351abaf3fb7a578495","Volgograd State University, Volgograd, Russian Federation","Inshakova, A.O., Volgograd State University, Volgograd, Russian Federation; Inshakova, E.I., Volgograd State University, Volgograd, Russian Federation; Deryugina, T.V., Volgograd State University, Volgograd, Russian Federation","The article is devoted to the pan-European information technologies aimed at optimizing the control of crossing the state borders of the pan-European territory, which is part of the Schengen area, taking into account such factors of development of modern reality as globalization and regionalization of the world economy, as well as the growing threat of international terrorism. Automated interstate information systems are considered in the article as a necessary measure of compensatory nature in the conditions of the common economic space functioning on the principles of freedom of movement of goods, services, capital and labor. As a result of the conducted research the priority measures of effective functioning and legal development of SIS are named and reasoned. Recommendations on legal provision of safety of functioning of network and information systems of the EU providing uninterrupted functioning of internal market are given. Formulated changes and additions to a number of existing EU instruments, in particular: Regulation EU №1987/2006. on the establishment, operation and use SIS II, Regulation on the visa information system, the EU Regulation №1987/2006 of 20.12.2006 on the establishment, operation and use of the Schengen information system (SIS II), Regulation EU №603/2013 of 26.06.2013 establishing the «Eurodac», Regulation EU 2017/2226 of 30.11.2017 establishing the entry exit - system, Regulation EU №1077/2011 of 25.10.2011 establishing a European Agency for the operational management of large-scale IT systems in the area of freedom, security and justice, Schengen Borders Code, Visa Code. © Springer Nature Switzerland AG 2020.","Automated information systems; Common European legal space; European space of freedom, security and justice; Information society; International regional integration association; Interstate cooperation; Legal system of the European union; Schengen achievements; Schengen agreement; Schengen informational system; Telecommunication technologies","Artificial intelligence; Codes (symbols); Information systems; Information use; Laws and legislation; Surveying instruments; Automated information; Common European legal space; European union; Information society; Informational system; Interstate cooperation; Regional integration; Schengen achievements; Security and justices; Telecommunication technologies; Information management","Inshakova, A.O.; Volgograd State UniversityRussian Federation; email: gimchp@volsu.ru","Popkova E.G.Sergi B.S.","Springer",21945357,9783030393182,,,"English","Adv. Intell. Sys. Comput.",Conference Paper,"Final","",Scopus,2-s2.0-85081663037
"Abomhara M., Yayilgan S.Y., Nymoen A.H., Shalaginova M., Székely Z., Elezaj O.","36179511800;57204767591;57212506973;57212510588;36935356200;57200092624;","How to Do It Right: A Framework for Biometrics Supported Border Control",2020,"Communications in Computer and Information Science","1111 CCIS",,,"94","109",,5,"10.1007/978-3-030-37545-4_7","https://www.scopus.com/inward/record.uri?eid=2-s2.0-85076880851&doi=10.1007%2f978-3-030-37545-4_7&partnerID=40&md5=e3d124d00d91915f284dcfad74df25a2","Department of Information Security and Communication Technology, Norwegian University of Science and Technology, Gjøvik, Norway; Faculty of Law Enforcement, National University of Public Service, Budapest, Hungary","Abomhara, M., Department of Information Security and Communication Technology, Norwegian University of Science and Technology, Gjøvik, Norway; Yayilgan, S.Y., Department of Information Security and Communication Technology, Norwegian University of Science and Technology, Gjøvik, Norway; Nymoen, A.H., Department of Information Security and Communication Technology, Norwegian University of Science and Technology, Gjøvik, Norway; Shalaginova, M., Department of Information Security and Communication Technology, Norwegian University of Science and Technology, Gjøvik, Norway; Székely, Z., Faculty of Law Enforcement, National University of Public Service, Budapest, Hungary; Elezaj, O., Department of Information Security and Communication Technology, Norwegian University of Science and Technology, Gjøvik, Norway","Complying with the European Union (EU) perspective on human rights goes or should go together with handling ethical, social and legal challenges arising due to the use of biometrics technology as border control technology. While there is no doubt that the biometrics technology at European borders is a valuable element of border control systems, these technologies lead to issues of fundamental rights and personal privacy, among others. This paper discusses various ethical, social and legal challenges arising due to the use of biometrics technology in border control. First, a set of specific challenges and values affected were identified and then, generic considerations related to mitigation of these issues within a framework is provided. The framework is expected to meet the emergent need for supplying interoperability among multiple information systems used for border control. © Springer Nature Switzerland AG 2020.","Biometrics; Border control; Ethical challenges; Legal challenges; Social challenges","Interoperability; Man machine systems; Pattern recognition systems; Philosophical aspects; Social aspects; Biometrics technology; Border control; Ethical challenges; European union; Legal challenges; Multiple information systems; Personal privacy; Social challenges; Biometrics","Abomhara, M.; Department of Information Security and Communication Technology, Norway; email: mohamed.abomhara@ntnu.no","Katsikas S.Katsikas S.Zorkadis V.","Springer",18650929,9783030375447,,,"English","Commun. Comput. Info. Sci.",Conference Paper,"Final","All Open Access, Green",Scopus,2-s2.0-85076880851
"Peers S.","7003830836;","Legislative Update: EC Immigration and Asylum Law, 2008: Visa Information System",2020,"European Journal of Migration and Law","11","1",,"69","94",,1,"10.1163/157181609X410593","https://www.scopus.com/inward/record.uri?eid=2-s2.0-85055404573&doi=10.1163%2f157181609X410593&partnerID=40&md5=6d5af212a97212456380d626c3dbfed1","University of Essex, United Kingdom","Peers, S., University of Essex, United Kingdom",[No abstract available],,,"Peers, S.; University of EssexUnited Kingdom",,"Brill Nijhoff",1388364X,,,,"English","Eur. J. Migr. Law",Review,"Final","",Scopus,2-s2.0-85055404573
"Lo Bianco S., Princen S.B.M.","57194073463;6506731570;","How strong is deliberation in EU intergovernmental decision making? Deliberation in the field of Justice and Home Affairs",2019,"Journal of European Integration","41","6",,"729","744",,1,"10.1080/07036337.2019.1587419","https://www.scopus.com/inward/record.uri?eid=2-s2.0-85062693668&doi=10.1080%2f07036337.2019.1587419&partnerID=40&md5=869db6c411a54d53b0b1156f5cbcc335","Research Group Changing Role of Europe, The Hague University of Applied Sciences, The Hague, Netherlands; Faculty of Law, Economics and Governance, Utrecht University School of Governance, Utrecht University, Utrecht, Netherlands","Lo Bianco, S., Research Group Changing Role of Europe, The Hague University of Applied Sciences, The Hague, Netherlands; Princen, S.B.M., Faculty of Law, Economics and Governance, Utrecht University School of Governance, Utrecht University, Utrecht, Netherlands","The argument that intergovernmental decision making in the EU is not marked by bargaining alone and that occurrences of deliberation play an important role is gaining increasing recognition in the literature. In this article, we critically evaluate that claim by developing a notion of deliberation along Habermasian lines, in which deliberation is understood as a process that induces negotiating partners to change positions through argumentation. Based on this conceptualization, we explore to what extent and under which conditions deliberation is likely to occur in intergovernmental settings. To that end, we analyse decision-making on the proposal to give law enforcement authorities access to the Visa Information System. We conclude that a ‘thicker’ conceptualization yields relatively few instances of deliberation. Moreover, we identify a number of specific conditions, and interrelationships between them, that are conducive to this kind of deliberation. © 2019, © 2019 Informa UK Limited, trading as Taylor & Francis Group.","Constructivism; deliberation; European Union; Intergovernmentalism; Justice and Home Affairs (JHA); Visa Information System (VIS)",,"Lo Bianco, S.; Research Group Changing Role of Europe, Netherlands; email: s.lobianco@hhs.nl",,"Routledge",07036337,,,,"English","J. Eur. Integr.",Article,"Final","",Scopus,2-s2.0-85062693668
"Pollozek S., Passoth J.H.","57207944128;36661286400;","Infrastructuring European migration and border control: The logistics of registration and identification at Moria hotspot",2019,"Environment and Planning D: Society and Space","37","4",,"606","624",,26,"10.1177/0263775819835819","https://www.scopus.com/inward/record.uri?eid=2-s2.0-85063345238&doi=10.1177%2f0263775819835819&partnerID=40&md5=79b8e17702e6815e14054ff085a5ff9d","Technical University of Munich, Germany","Pollozek, S., Technical University of Munich, Germany; Passoth, J.H., Technical University of Munich, Germany","This paper examines Moria hotspot in Greece as a logistical site which fulfills two different functions within the European migration and border regime. It locates, contains, and sorts individuals locally at the external borders of the EU and creates, inserts, and processes data for controlling people on the move. Based on ethnographic fieldwork in Greece, including interviews with local administrators from the Registration and Identification Service, Médecins du Monde, Frontex and Hellenic Police and a collection of internal and publicly available planning, policy, and management documents and handbooks, the paper scrutinizes how both the movement of migrants and data is organized at the site. By developing an analytic lens of logistics, it outlines a specific mode of infrastructuring which aligns staff from different organizations with databases, devices, and migrants all in one place and organizes mundane practices such as filling out forms, taking fingerprints, signing, and entering datasets along a chain. That way the hotspot is able to locate, sort, and detain those who arrive at the hardened EU border and to create a data infrastructure for controlling, monitoring, and governing further movement by processing data through the bureaucratic channels of the EU’s transnational control assemblages. © The Author(s) 2019.","Actor-Network Theory; border; control; data; infrastructure; logistics; migration","actor network theory; border region; bureaucracy; European Union; infrastructure planning; migration; territorial management; Greece; Moria","Pollozek, S.; Technical University of MunichGermany; email: silvan.pollozek@tum.de",,"SAGE Publications Ltd",02637758,,,,"English","Environ. Plann. D Soc. Space",Article,"Final","All Open Access, Hybrid Gold, Green",Scopus,2-s2.0-85063345238
"Glouftsios G.","57197773539;","Designing digital borders: The Visa Information System (VIS)",2019,"Technology and Agency in International Relations",,,,"164","187",,4,,"https://www.scopus.com/inward/record.uri?eid=2-s2.0-85089992635&partnerID=40&md5=fa582a38bef6db65d5690fe5fb799f8a","University of Trento, Italy","Glouftsios, G., University of Trento, Italy",[No abstract available],,,"Glouftsios, G.; University of TrentoItaly",,"Taylor and Francis Inc.",,9780429871757; 9781138615397,,,"English","Technol. and Agency in Int. Relat.",Book Chapter,"Final","",Scopus,2-s2.0-85089992635
"Inshakova A.O., Kochetkova S.Y., Serbina E.A.","56185976100;57210614058;57208153547;","The Schengen Information System: Legal support for the automated cross-border business management",2019,"IOP Conference Series: Materials Science and Engineering","483","1","012101","","",,1,"10.1088/1757-899X/483/1/012101","https://www.scopus.com/inward/record.uri?eid=2-s2.0-85063966861&doi=10.1088%2f1757-899X%2f483%2f1%2f012101&partnerID=40&md5=1dad8f6999e3d7bf96541848b347d903","Volgograd State University, Department of Civil and International Private Law, prosp. Universitetsky, 100, Volgograd, 400062, Russian Federation; Volgograd State University, Department of Germanic and Romanic Philology, prosp. Universitetsky, 100, Volgograd, 400062, Russian Federation","Inshakova, A.O., Volgograd State University, Department of Civil and International Private Law, prosp. Universitetsky, 100, Volgograd, 400062, Russian Federation; Kochetkova, S.Y., Volgograd State University, Department of Germanic and Romanic Philology, prosp. Universitetsky, 100, Volgograd, 400062, Russian Federation; Serbina, E.A., Volgograd State University, Department of Civil and International Private Law, prosp. Universitetsky, 100, Volgograd, 400062, Russian Federation","This study examines the impact of the development of the information and communication technologies on the social, economic and political systems of the member countries of the united Europe, as well as the countries entering into business and production relations with them. The authors reveal the issues of using the Internet as a tool of the loyal border management of the united countries, ensuring the liberalization of the movement of factors of production through the creation of a single space of freedom, security and justice. The infocommunication technologies are researched as a management mechanism with regard to their influence on modern geopolitical, economic, and specifically industrial processes. The indicated approach is implemented simultaneously both as the management of the content of political relations and the management of their form. The Schengen border management information system is regarded as one of the most striking examples of the information technologies use in the political, economic, and specifically industrial sphere. The structure and legal mechanisms of this system operation are analyzed, on the basis of which the advantages and disadvantages of technological and legal nature are revealed. Special attention is paid to the analysis of the draft laws under development aimed at the improvement of the Schengen information system as an electronic technology for the automated border management of the pan-European space of freedom, security and justice. Among other things the authors have taken into account the latest changes in the legal regulation of the Schengen information system, which took place in October 2018.Taking into account the identified shortcomings in the functioning of the Schengen information system, the recommendations for their elimination are formulated. It is concluded that it is necessary to create a single European information portal in order to optimize the processing of data received from the different agencies. The general trends of the SIS II reform are the simplification and acceleration of the procedures, as well as the strengthening of the personal data protection. © Published under licence by IOP Publishing Ltd.",,"Industrial economics; Information use; Security of data; Business management; Electronic technologies; Factors of production; Industrial processs; Information and Communication Technologies; Information portals; Management mechanisms; Security and justices; Information management",,"Shamne N.L.Malushko E.Y.","Institute of Physics Publishing",17578981,,,,"English","IOP Conf. Ser. Mater. Sci. Eng.",Conference Paper,"Final","All Open Access, Bronze",Scopus,2-s2.0-85063966861
"Sacco P., Muscolo F., Codispoti G., Tuozzi A.","56513557000;57203368632;6507661149;6507306543;","Challenges and benefits of Space Technologies application in the Integrated Maritime Surveillance: The EUCISE2020 project",2019,"Proceedings of the International Astronautical Congress, IAC","2019-October",,"IAC-19_B1_5_4_x49945","","",,,,"https://www.scopus.com/inward/record.uri?eid=2-s2.0-85079143333&partnerID=40&md5=483437060b4c414b0236f31b2ba17097","Telecommunication and Navigation Division, Italian Space Agency, Via del Politecnico s.n.c., Rome, 00133, Italy","Sacco, P., Telecommunication and Navigation Division, Italian Space Agency, Via del Politecnico s.n.c., Rome, 00133, Italy; Muscolo, F., Telecommunication and Navigation Division, Italian Space Agency, Via del Politecnico s.n.c., Rome, 00133, Italy; Codispoti, G., Telecommunication and Navigation Division, Italian Space Agency, Via del Politecnico s.n.c., Rome, 00133, Italy; Tuozzi, A., Telecommunication and Navigation Division, Italian Space Agency, Via del Politecnico s.n.c., Rome, 00133, Italy","Since 2010, the European Union launched the Integrated Maritime Policy (IMP) to promote a sustainable growth, the Blue Growth Strategy, in the marine and maritime sectors. A pillar of the IMP is the common environment of Integrated Maritime Surveillance, to improve the exchange of information among the national authorities of the operational sectors involved (transport, environmental protection, fisheries control, border control, application of the general law, customs and defense). CISE (Common Information Sharing Environment) is therefore a fundamental pillar of the European Integrated Maritime Policy and an element of the Action Plan of the European Maritime Security Strategy. CISE represents the collaborative environment on a voluntary basis among the Member States of the European Union, to achieve ""a more interoperable surveillance system to bring together existing monitoring and tracking systems used for maritime safety and security, protection of the marine environment, fisheries control, control of external borders and other law enforcement activities"". CISE implements a decentralized European environment of informative cooperation among all user communities, both civilian and military, at cross-sectoral and cross-border level, including EU agencies, developing an interoperable and information-sharing network powered by information flows coming from National and European information systems in force. This paper aims to investigate and describe the advantages and the capabilities that can be reached with an integrated use of currently in-orbit Earth Observation Systems, with traditional existing systems for the specific application of Maritime Surveillance. Copyright © 2019 by the International Astronautical Federation (IAF). All rights reserved.","EUCISE2020; Information Sharing; Integrated Maritime Policy; Satellite services","Environmental regulations; Fisheries; Information analysis; Interoperability; Monitoring; Orbits; Sustainable development; Waterway transportation; Collaborative environments; Earth observation systems; EUCISE2020; Exchange of information; Information sharing; Information sharing network; Monitoring and tracking; Satellite services; Information dissemination","Sacco, P.; Telecommunication and Navigation Division, Via del Politecnico s.n.c., Italy; email: patrizia.sacco@asi.it",,"International Astronautical Federation, IAF",00741795,,,,"English","Proc. Int. Astronaut. Congr., IAC",Conference Paper,"Final","",Scopus,2-s2.0-85079143333
"Mahamut R.G., Cordero J.V.","56151736800;57533846600;","The protection of asylum seeker's personal data in the (new) european common asylum system: Major challenges and serious shortcomings [La protección de los datos personales de los solicitantes de protección internacional en el (Nuevo) sistema europeo común de asilo: Grandes desafíos y graves deficiencias]",2019,"Teoria y Realidad Constitucional",,"44",,"237","270",,1,,"https://www.scopus.com/inward/record.uri?eid=2-s2.0-85076594366&partnerID=40&md5=e695254814fe731b73610c43828fe3ef","University Jaume, Spain; Universitat Jaume I, Spain","Mahamut, R.G., University Jaume, Spain; Cordero, J.V., Universitat Jaume I, Spain","The present work addresses an innovative legal analysis on the treatment and protection of personal data about asylum and subsidiary protection seekers in the comprehensive reform of the Common European Asylum System (CEAS). This reform, among other countless aspects, has increased the effective EU Information Management as the key to protect external borders, improve the management of migration flows and contribute to the enhancement of internal security. The applicable data protection legislation is significantly fragmented, complex and diffuse since, despite the GDPR excludes from its scope asylum-related activities, border control, and immigration is directly defined in the proposed Dublin IV, Procedures and Eurodac regulations. At the same time, the persistent linkages to the security of Member States can reflect the potential application of the Data Protection Directive on Police Matters. In addition, the interoperability of different information systems, the deployment of specific bodies (such as Frontex or EASO) as well as law enforcement authorities are bound directly by their own regulations. Consequently, this fragmented and particularly complex legal framework constitutes the subject of the study. © 2019 Universidad Nacional de Educacion a Distancia.","Border security; CEAS reform; Data protection directive in in police matters; Dublin iv system; General data protection regulation; international protection; Protection and processing of asylum seekers personal data; Refugees; Subsidiary protection; UNHCR",,,,"Universidad Nacional de Educacion a Distancia",11395583,,,,"Spanish","Teor. Real. Const.",Article,"Final","",Scopus,2-s2.0-85076594366
