"Hick S., Rahmun F., Hammerschmidt E.","23088464100;55598377300;15044239800;","Visa applications in tg biometrics for public sector applications",2011,"ISSE 2010 - Securing Electronic Business Processes: Highlights of the Information Security Solutions Europe 2010 Conference",,,,"315","322",,,"10.1007/978-3-8348-9788-6_30","https://www.scopus.com/inward/record.uri?eid=2-s2.0-84883725404&doi=10.1007%2f978-3-8348-9788-6_30&partnerID=40&md5=4e9712e1cd844e8430dd62d3ebfb7929","Secunet Security Networks AG, Kronprinzenstrasse 30, 45128 Essen, Germany; Bundesverwaltungsamt, 50735 Koln, Germany","Hick, S., Secunet Security Networks AG, Kronprinzenstrasse 30, 45128 Essen, Germany; Rahmun, F., Bundesverwaltungsamt, 50735 Koln, Germany; Hammerschmidt, E., Secunet Security Networks AG, Kronprinzenstrasse 30, 45128 Essen, Germany","The application, issuance and usage of modern electronic identity documents that are connected to bio-metric data is only possible after a complex process of requirements and regulations has been carried out together with the establishment of a respective infrastructure. Although different governmental elD documents are connected to various requirements, the structure and approach of the modus operandi is quite similar. Therefore, synergistic effects can be used to represent the processes connected to these documents. In Germany, the Federal Office for Information Security has published a Technical Guideline ""Biometrics for Public Sector Applications"" that encloses requirements, recommendations, and best practices to design processes for the handling of the afore described documents within the context of biometrics. Not only electronic documents but also different applications have to be considered. As a result, a number of Application Profiles have been provided covering these circumstances. The description is based on experiences that were gained in several projects: e.g. the introduction of electronic passports in 2005, the preparation of new electronic national identity cards in Germany, and the experiences gained in the European BioDEV II pilot project for Visa which has been carried out to prepare the central European Visa Information System. © Vieweg+Teubner Verlag | Springer Fachmedien Wiesbaden GmbH 2011.",,"Biometrics; Security of data; Complex Processes; Electronic document; Electronic identity; Electronic passports; Public sector applications; Synergistic effect; Technical guidelines; Visa information systems; Electronics industry",,,"Vieweg and Teubner Verlag",,9783834814388,,,"English","ISSE - Secur. Electron. Bus. Process.: Highlights Inf. Secur. Solutions Europe Conf.",Conference Paper,"Final","",Scopus,2-s2.0-84883725404
"Gruner L., Buchroithner M.F.","36674930600;6603433614;","A bilingual geo-information system for barrier-free cross-border tourism in two adjacent National Parks",2010,"Kartographische Nachrichten","60","6",,"321","325",,,,"https://www.scopus.com/inward/record.uri?eid=2-s2.0-78650155832&partnerID=40&md5=808665d14e411c9d520190b80ed57270","Projektkoordinator am Institut für Kartographie, Technischen Universität, Dresden, Germany; Geschäftsführender Direktor, Instituts für Kartographie, Germany","Gruner, L., Projektkoordinator am Institut für Kartographie, Technischen Universität, Dresden, Germany; Buchroithner, M.F., Geschäftsführender Direktor, Instituts für Kartographie, Germany","Protected landscapes divided by political borders into two ore more nature-conservation areas often face comparable problems. Regions of cultural and natural heritage are also regions of tourism interests. Bohemian-Saxon Switzerland on both sides of the Czech-German border is a region for tourists and healthseekers. For handicapped people, mainly wheelchair-bound people, it is often diffcult to identify passable ways within the nature reserves in topographic or tourism maps. The paper deals with practical aspects of geo-data utilization for creating a Tourist Information System (TIS) for barrier-free tourism in Bohemian-Saxon Switzerland. This cross-border TIS contains digital data about length, level of diffculty, slope, surface and condition of the paths, valuable information for planning, and tour suggestions for handicapped people. Some of the main objectives of the project SISTEMaPARC, which was the master project, are the cross-border compatibility of geometric and thematic data, the management and development of cross-border national park regions in Europe and the fostering an effcient regional management and sustainable development of protected regions. This TIS for barrier-free tourism is embedded into the activities of the EU-Project SISTEMaPARC.","Barrier-free tourism; Cross-border management of protected areas; Geo-information system; GIS for handicapped; National parks bohemian and saxon switzerland; Sustainability in tourism; Visualization of geo-data",,"Gruner, L.; Projektkoordinator am Institut für Kartographie, , Dresden, Germany; email: Lutz.Gruner@web.de",,,00229164,,,,"English","Kartographische Nachr.",Article,"Final","",Scopus,2-s2.0-78650155832
"Loumos V., Christonakis G., Mpardis G., Tziova P.","35498858500;36238854100;23005224900;36239459800;","Change management and quality of service through business process modeling: The N-VIS, a public sector project",2010,"ITNG2010 - 7th International Conference on Information Technology: New Generations",,,"5501572","1300","1303",,,"10.1109/ITNG.2010.71","https://www.scopus.com/inward/record.uri?eid=2-s2.0-77955298562&doi=10.1109%2fITNG.2010.71&partnerID=40&md5=5aa39751851b48aa361fd81165fe0163","National Technical University of Athens, Athens, Greece; Ministry of Foreign Affairs, Athens, Greece","Loumos, V., National Technical University of Athens, Athens, Greece; Christonakis, G., Ministry of Foreign Affairs, Athens, Greece; Mpardis, G., National Technical University of Athens, Athens, Greece; Tziova, P., Ministry of Foreign Affairs, Athens, Greece","Outsourcing in the Public sector has become common practice in the United States and is spreading rapidly in the European Union. When Information & Communication Technologies (ICT) are involved, outsourcing becomes rather complex. In such cases, a clear definition of the processes to be implemented and a quality assurance monitoring system are crucial factors for success. In addition, globalization, world level financial instability and the need to adjust to evolving standards and requirements, compel Governments and Public Organizations to become more adaptable and to handle changes efficiently. This last constraint has a direct impact on the design of ICT systems; Business Process Modeling becomes mandatory as the most appropriate change management mechanism. In this paper, a new methodology is presented based on Business Process Modeling. Once the model is completed, the relative program code of the final system is produced. In addition to this system, an end-to-end monitoring platform is developed to continuously search, identify and assess technical and human deficiencies. This goal is achieved by following-up the quantitative and qualitative characteristics of the processes, through the creation and management of adequate Key Performance Indicators (KPIs). Once the technical problems are suitably addressed, the focus moves to human skills and competency. In this case, clearly defined training needs can be covered adequately and the system can be used optimally. This new methodology has already been tested successfully on a simple Bank application, a short description of which is included in this paper. The next step is to apply the methodology on N-VIS, the Greek National Visa Information System that is responsible for the exchange of visa application data between the Greek Authorities and the Schengen Member States. © 2010 IEEE.","BPEL; BPMN; KPI; Visa","Application data; Business process modeling; Change management; Communication technologies; Direct impact; End-to-end monitoring; European Union; Human skills; Key performance indicators; Member state; Monitoring system; Program code; Public organizations; Public sector; Public-sector projects; Technical problem; Visa information systems; Information technology; Machine design; Outsourcing; Quality assurance; Quality control; Quality of service; Total quality management; Benchmarking","Loumos, V.; National Technical University of Athens, Athens, Greece; email: loumos@cs.ntua.gr",,,,9780769539843,,,"English","ITNG - Int. Conf. Inf. Technol.: New Generations",Conference Paper,"Final","",Scopus,2-s2.0-77955298562
"O’Neill M.","25028445200;","The Issue of Data Protection and Data Security in the (Pre-Lisbon) EU Third Pillar",2010,"Journal of Contemporary European Research","6","2",,"211","235",,8,,"https://www.scopus.com/inward/record.uri?eid=2-s2.0-84859350694&partnerID=40&md5=d29a50f00ef7dcd8a4e0f57db8a92ccf","University of Abertay Dundee, United Kingdom","O’Neill, M., University of Abertay Dundee, United Kingdom","The key functional operability in the pre-Lisbon PJCCM pillar1 of the EU is the exchange ofintelligence and information amongst the law enforcement bodies of the EU. The twin issues ofdata protection and data security within what was the EU’s third pillar legal framework thereforecome to the fore. With the Lisbon Treaty reform of the EU, and the increased role of the Commissionin PJCCM policy areas, and the integration of the PJCCM provisions with what have traditionallybeen the pillar I activities of Frontex, the opportunity for streamlining the data protection and datasecurity provisions of the law enforcement bodies of the post-Lisbon EU arises. This is recognisedby the Commission in their drafting of an amending regulation for Frontex2, when they say thatthey would prefer “to return to the question of personal data in the context of the overall strategyfor information exchange to be presented later this year and also taking into account the reflectionto be carried out on how to further develop cooperation between agencies in the justice and homeaffairs field as requested by the Stockholm programme.”3 The focus of the literature published onthis topic, has for the most part, been on the data protection provisions in Pillar I, EC. While thefocus of research has recently sifted to the previously Pillar III PJCCM provisions on data protection,4a more focused analysis of the interlocking issues of data protection and data security needs to bemade in the context of the law enforcement bodies, particularly with regard to those which werebased in the pre-Lisbon third pillar. This paper will make a contribution to that debate, arguing thata review of both the data protection and security provision post-Lisbon is required, not only inorder to reinforce individual rights, but also inter-agency operability in combating cross-border EUcrime. The EC’s provisions on data protection, as enshrined by Directive 95/46/EC, do not apply tothe legal frameworks covering developments within the third pillar of the EU. Even CouncilFramework Decision 2008/977/JHA, which is supposed to cover data protection provisions withinPJCCM expressly states that its provisions do not apply to “Europol, Eurojust, the SchengenInformation System (SIS)” or to the Customs Information System (CIS). In addition, the post Treaty ofPrüm provisions covering the sharing of DNA profiles, dactyloscopic data and vehicle registrationdata pursuant to Council Decision 2008/615/JHA, are not to be covered by the provisions of the2008 Framework Decision. As stated by Hijmans and Scirocco, the regime is “best defined as apatchwork of data protection regimes”, with “no legal framework which is stable and unequivocal,like Directive 95/46/EC in the First pillar”.5 Data security issues are also key to the sharing of data in organised crime or counterterrorism situations. This article will critically analyse the current legalframework for data protection and security within the third pillar of the EU. © 2010, Journal of Contemporary European Research. All Rights Reserved.","Data protection; Data security; Eurojust; Europol; PJCCM; Schengen Prüm",,,,"University Association for Contemporary European Studies",1815347X,,,,"English","J. Contemp. Eur. Res.",Article,"Final","",Scopus,2-s2.0-84859350694
"Pimenidis E.","25636407200;","Digital identity management",2010,"Handbook of Electronic Security and Digital Forensics",,,,"279","294",,,"10.1142/9789812837042_0015","https://www.scopus.com/inward/record.uri?eid=2-s2.0-84970979631&doi=10.1142%2f9789812837042_0015&partnerID=40&md5=6e467c1aba8325fb775b092a62e44895","School of Computing, IT and Engineering, University of East London, United Kingdom","Pimenidis, E., School of Computing, IT and Engineering, University of East London, United Kingdom","Organisations are currently managing sensitive information of millions of individuals on an online basis. Increasingly people have little control over their own information and this is the real challenge facing organisations and governments in an era of exponential creation, networking and duplication of data, most of which is identifiable in nature. Traditionally, identity management has been considered as the process of managing information for a person's interaction with an organization's information systems and assets. Nowadays, there is a key fundamental business shift away from the traditional approach in which a user's identity was managed manually on a system-by-system basis. Federated identity management, which supports multiple entities connected within a circle of trust, is one of the major initiatives growing out of Web services that will provide substantial benefits to corporations and consumers. Federated identity management (IDM) refers to the ability to establish trust relationships between various security domains to enable the passing of authentication, authorization and privacy assertions. This is a key aspect of identity management in the context of business-to-business integration, typically when Web services technology is used. The European Union is actively pursuing an interoperable pan-European e-IDM since 2006. Under this initiative, EU governments have agreed to facilitate, as a matter of high priority, the establishment for mutual recognition of national electronic identities for public administration Web sites and services. The key reason for promoting the interoperability of e-identification is the growth of demand for cross-border services, which needs to be met by equivalent crossborder framework of cooperation. Once this initiative reaches a good level of success and an acceptable maturity level, it could possibly prove the model for a worldwide interoperable e-identification system, increasing the efficiency of transactions, and significantly enhancing the effectiveness of border control systems. © 2010 by World Scientific Publishing Co. Pte. Ltd. All rights reserved.",,"Authentication; Electronic document identification systems; Identification (control systems); Interoperability; Knowledge based systems; Public administration; Web services; Websites; Business to business integration; Cross-border services; Digital identity management; Federated identity managements; Identity management; Sensitive informations; Traditional approaches; Web Services technologies; Information management","Pimenidis, E.; School of Computing, United Kingdom",,"World Scientific Publishing Co.",,9789812837042; 9812837035; 9789812837035,,,"English","Handb. of Electronic Security and Digital Forensics",Book Chapter,"Final","",Scopus,2-s2.0-84970979631
"Besters M., Brom F.W.A.","36634029500;6603118585;","'Greedy' information technology: The digitalization of the European migration policy",2010,"European Journal of Migration and Law","12","4",,"455","470",,22,"10.1163/157181610X535782","https://www.scopus.com/inward/record.uri?eid=2-s2.0-78649298081&doi=10.1163%2f157181610X535782&partnerID=40&md5=7dc4e76a977856f44a42bdc8a2600f53","Technology Assessment Department, Rathenau Institute, The Hague, Netherlands; Department of Philosophy, School of Humanities, Tilburg University, Netherlands; Ethics Institute, Utrecht University, Netherlands","Besters, M., Technology Assessment Department, Rathenau Institute, The Hague, Netherlands, Department of Philosophy, School of Humanities, Tilburg University, Netherlands; Brom, F.W.A., Technology Assessment Department, Rathenau Institute, The Hague, Netherlands, Ethics Institute, Utrecht University, Netherlands","European borders are being transformed into digital borders. The ambition behind the European information systems - like the Schengen Information System and Eurodac - is to establish a single Union information system to control the flux of migrants. We show that in this process information technology is not a neutral tool to reach established goals but that it is 'greedy'. This greediness indicates the distorting potential of information technology regarding the means-end logic. Our analysis suggests that the European migration policy is stuck in a 'digital fix', i.e. a technological fix focusing on ICT. We identify three political issues concerning greedy information technology within the context of the European migration policy. The first issue concerns the democratic control on information systems. The second issue discusses the weak legal position of immigrants. The third issue inquires into the effectiveness of information systems as a policy instrument. © Koninklijke Brill NV, Leiden, 2010.","digital borders; European migration policy; illegal immigrants; information technology; Schengen information system",,"Besters, M.; Technology Assessment Department, , The Hague, Netherlands",,,1388364X,,,,"English","Eur. J. Migr. Law",Article,"Final","",Scopus,2-s2.0-78649298081
"Stephenne N., Magoni R., Laneve G.","6506067047;55996280600;6603065055;","From real time border monitoring to a permeability model",2009,"Remote Sensing from Space: Supporting International Peace and Security",,,,"239","259",,1,"10.1007/978-1-4020-8484-3_15","https://www.scopus.com/inward/record.uri?eid=2-s2.0-84891979072&doi=10.1007%2f978-1-4020-8484-3_15&partnerID=40&md5=f7d123256d1be1ee9c370b9d219bff0e","Institute for the Protection and Security of the Citizen, Joint Research Centre, European Commission, Via Fermi 1, 21020 Ispra, (VA), Italy; Centro di Ricerca Progetto San Marco, Università di Roma la Sapienza, Via Salaria 851, 00138 Roma, Italy","Stephenne, N., Institute for the Protection and Security of the Citizen, Joint Research Centre, European Commission, Via Fermi 1, 21020 Ispra, (VA), Italy; Magoni, R., Institute for the Protection and Security of the Citizen, Joint Research Centre, European Commission, Via Fermi 1, 21020 Ispra, (VA), Italy; Laneve, G., Centro di Ricerca Progetto San Marco, Università di Roma la Sapienza, Via Salaria 851, 00138 Roma, Italy","International migration has risen to the top of the global policy agenda (GCIM 2005). This paper assesses the potential use of satellite imagery to monitor flows of people across borders. The objective of this ""border monitoring"" assessment is to contribute to the development of scenarios on potential future migration through land borders and to develop recommendations for border management. This study begins with an assessment of statistical and earth observation information datasets to monitor border crossing in real time. Due to the unavailability of relevant data, this study evolved towards an indirect definition of migrants' likelihood to cross the border (the border permeability). The permeability model combines earth observation and geo-spatial technologies with formal decision theory to assess the likelihood that a border area may be crossed by an illegal migrant, based on a presumed cost/opportunity behavioural strategy. Two preliminary permeability models were developed on two different areas, the EU-25 land border and the Central African region. The resulting permeability maps help in the overall understanding of illegal migration patterns. In the border monitoring process, they help to identify high permeability areas where change detection analysis can be carried out using medium resolution satellite imagery. © 2009 Springer Science+Business Media B.V.","geographical information system; Illegal migration; multi-criteria model; remote sensing; statistics",,"Stephenne, N.; Institute for the Protection and Security of the Citizen, Via Fermi 1, 21020 Ispra, (VA), Italy; email: nathalie.stephenne@jrc.it",,"Springer Netherlands",,9781402084836,,,"English","Remote Sens. from Sp.: Support. Intl. Peace and Secty.",Book Chapter,"Final","",Scopus,2-s2.0-84891979072
"Schaper T., Chlistalla M.","35096939300;35096051500;","Deriving a balanced scorecard for the European settlement industry",2009,"15th Americas Conference on Information Systems 2009, AMCIS 2009","3",,,"1755","",,,,"https://www.scopus.com/inward/record.uri?eid=2-s2.0-84870787550&partnerID=40&md5=f501786a4fc28baf10bbd3ce7461daa5","Goethe-University Frankfurt, Frankfurt, Germany; E-Finance Lab, Goethe-University Frankfurt, Frankfurt, Germany","Schaper, T., Goethe-University Frankfurt, Frankfurt, Germany; Chlistalla, M., E-Finance Lab, Goethe-University Frankfurt, Frankfurt, Germany","The European settlement industry is currently facing competition in cross-border securities settlement. In order to meet the new challenges, the management needs to identify its stakeholders and their interests and must define a clear strategy that includes financial and nonfinancial aims. We apply a stepwise approach to derive a Balanced Scorecard for this particular industry. To meet the specifics of the settlement industry, we adjust and extend the scorecard of Kaplan and Norton's original concept by introducing IT into the modified BSC and by documenting the need to consider important strategic projects. Furthermore, we outline our research model for the validation of these modifications. © (2009) by the AIS/ICIS Administrative Office All rights reserved.",,"Balanced scorecards; Cross-border; Research models; Stepwise approach; Industry; Information systems; Competition","Schaper, T.; Goethe-University Frankfurt, Frankfurt, Germany",,,,9781615675814,,,"English","Amer. Conf. Inf. Sys., AMCIS",Conference Paper,"Final","",Scopus,2-s2.0-84870787550
"Berglund E., Karbauskaite R.","57197542962;15759405200;","Frontex perspectives on biometrics for border checks",2008,"Lecture Notes in Informatics (LNI), Proceedings - Series of the Gesellschaft fur Informatik (GI)",,,,"107","115",,3,,"https://www.scopus.com/inward/record.uri?eid=2-s2.0-84873930693&partnerID=40&md5=c03cf594643949fd16b51a8199e51c5f","Frontex, Rondo ONZ 1, 00-124 Warsaw, Poland","Berglund, E., Frontex, Rondo ONZ 1, 00-124 Warsaw, Poland; Karbauskaite, R., Frontex, Rondo ONZ 1, 00-124 Warsaw, Poland","The European Union is developing new concepts for border management. Biometrics is seen is a key technology to facilitate more secure and convenient border management. Biometric information in the form of the facial image is already stored in the electronic passports, and from 2009 fingerprints will also be stored. Also from 2009, biometrics will be introduced in the Visa Information System (VIS). The VIS will store facial images and fingerprints of all visa applicants and a check against the stored data will be performed at the border crossing. The use of biometrics makes the concept of automated border crossing feasible. Frontex has studied such systems and found them to perform well. There are, however, several design issues that need to be addressed to make the systems more user friendly.",,"Biometric informations; Border crossings; Design issues; Electronic passports; European union; Facial images; Key technologies; User friendly; Visa information systems; Biometrics","Berglund, E.; Frontex, Rondo ONZ 1, 00-124 Warsaw, Poland; email: erik.berglund@frontex.europa.eu",,,16175468,9783885792314,,,"English","Lect. Notes Informatics (LNI), Proc. - Series Ges. Inform. (GI)",Conference Paper,"Final","",Scopus,2-s2.0-84873930693
"Baldaccini A.","24167827500;","Counter-terrorism and the EU strategy for border security: Framing suspects with biometric documents and databases",2008,"European Journal of Migration and Law","10","1",,"31","49",,23,"10.1163/138836407X261308","https://www.scopus.com/inward/record.uri?eid=2-s2.0-42949141615&doi=10.1163%2f138836407X261308&partnerID=40&md5=742aef1eab09a493649f58b545454741","House of Lords, EU Committee","Baldaccini, A., House of Lords, EU Committee","This article examines the way in which the EU amd its Member States have approached border security issues since the terrorist attacks in the US on 11 September 2001. A key aspect of this approach has been to tighten control of borders and the safety of documents by the use of biometric systems. The new policies on border security and document security are resulting in the mass collection and storage of biometric data in relation to third-country nationals seeking entry into the territory of EU Member States, and in relation to EU nationals within the context of travel and identity documents. These developments are significant as the Union is considering the potential offered by biometrics not only for the effective management of borders but also for the prevention and combating of crime. © 2008 Martinus Nijhoff Publishers.","Biometrics; Border control; Document security; Euodac; Information systems; SIS; VIS",,"Baldaccini, A.; House of Lords, United Kingdom",,,1388364X,,,,"English","Eur. J. Migr. Law",Review,"Final","",Scopus,2-s2.0-42949141615
