"La Fors-Owczynik K.","56815118100;","Monitoring migrants or making migrants 'misfit'? Data protection and human rights perspectives on Dutch identity management practices regarding migrants",2016,"Computer Law and Security Review","32","3",,"433","449",,6,"10.1016/j.clsr.2016.01.010","https://www.scopus.com/inward/record.uri?eid=2-s2.0-84966508401&doi=10.1016%2fj.clsr.2016.01.010&partnerID=40&md5=3352d043b607868a22e3e901e84b5aa9","Tilburg Institute for Law, Technology and Society (TILT), Tilburg University, P.O. Box 90153, Tilburg, 5000 LE, Netherlands","La Fors-Owczynik, K., Tilburg Institute for Law, Technology and Society (TILT), Tilburg University, P.O. Box 90153, Tilburg, 5000 LE, Netherlands","Record numbers of migrants and refugees fleeing violence and poverty in parts of Africa and the Middle East present the European Union with unprecedented challenges, including in determining their identity as well as status. In recent years problems of identifying immigrants have been addressed in order to fight identity fraud and illegal entry of migrants. As a result, a wide variety of digital systems have been introduced to orchestrate an effective, preventative modus of identification of migrants. Digital systems are in particular geared towards spotting those migrants who (are about to) commit identity fraud or who enter the territory of EU member states illegally. Although the key aim of the digital systems is framed to protect the administrative, geographic and legal borders of the member state and the safety of its population, empirically based studies demonstrate that these systems bring new risks for migrants themselves. This article intends to contribute to the discussion on the use of digital systems for managing the movement of migrants by analysing identification and risk assessment systems from the perspective of the new European data protection regime and the European Convention on Human Rights. For this purpose, two identification systems - the so-called INS console within the Dutch immigration and border sector, and the PROGIS console within the law enforcement sector - are analysed. A third is the Advanced Passenger Information system operated at Schiphol Airport by border control and immigration services. Against the background of the position of many migrants finding themselves at risk in their home country and of the two legislative frameworks mentioned above, this article addresses two issues. First, the analysis focuses on how migrants are perceived by digital monitoring practices: are they themselves at risk, non-risk or do they pose a risk? In the EU, migrants must prove that their case is worthy of asylum status because they are 'at risk' from political unrest or other life-threatening circumstances in their home country. Yet, empirical data gathered through semi-structured interviews show that simply abiding by the standards during an enrolment process of the INS console, rather than being 'at risk', a migrant can easily be categorised as 'posing a risk' (La Fors-Owczynik & Van der Ploeg, 2015). Second, this article aims to investigate what the capacity of the new data protection regime is in protecting migrants from being framed as 'a risk' or a 'misfit' stemming from the use of digital systems. Given this second aim, the following discussion also intends to explore the extent to which the European Convention on Human Rights can provide an additional legal remedy for migrants being digitally categorised in a manner that is detrimental to them. © 2016 Karolina La Fors-Owczynik.","Biometrics; Border control; Data protection; Human rights; Identification; Immigration; Law enforcement; Migrants; Profiling; Risk","Air navigation; Biometrics; Crime; Data privacy; Identification (control systems); Law enforcement; Laws and legislation; Risks; Social aspects; Border control; Human rights; Immigration; Migrants; Profiling; Risk assessment","La Fors-Owczynik, K.; Tilburg Institute for Law, P.O. Box 90153, Netherlands; email: K.LaFors@uvt.nl",,"Elsevier Ltd",02673649,,CLSRE,,"English","Comput Law Secur. Rev.",Article,"Final","",Scopus,2-s2.0-84966508401
"Tsianos V.S., Kuster B.","36199134000;57189867564;","Eurodac in Times of Bigness: The Power of Big Data within the Emerging European IT Agency",2016,"Journal of Borderlands Studies","31","2",,"235","249",,11,"10.1080/08865655.2016.1174606","https://www.scopus.com/inward/record.uri?eid=2-s2.0-84975454486&doi=10.1080%2f08865655.2016.1174606&partnerID=40&md5=399e93dab358dad70096e92202da82b3","Universität Hamburg, Fakultät Wirtschafts- und Sozialwissenschaften, Fachbereich Sozialwissenschaften, Programmbereich Soziologie, Germany; Artist & Independent Researcher, Berlin, Germany","Tsianos, V.S., Universität Hamburg, Fakultät Wirtschafts- und Sozialwissenschaften, Fachbereich Sozialwissenschaften, Programmbereich Soziologie, Germany; Kuster, B., Artist & Independent Researcher, Berlin, Germany","Private and government sectors are operating hand in hand for biometric identity assurance solutions to meet security requirements at borders, for elections or for the private sector. Our paper will explore Eurodac, a large biometric information database concerning asylum applications and irregular border crossings, as part of the emerging European Big Data Economy. Drawing on the concept of the digital border and of the surveillance assemblage (Haggerty, Kevin D., and Richard V. Ericson. 2000. The Surveillant Assemblage. British Journal of Sociology 51, no. 4: 605–22) we understand Eurodac not only as a technological border but as inflected by social, symbolic, organizational and juridical cultures, practices, and imaginaries that are beyond the literal realm of the electronic space. Our paper investigates the dynamics of big data in the context of the integration of Eurodac within the larger framework of the European Agency for the operational management of large-scale IT systems in the area freedom, security and justice (EU-LISA). EU-LISA is the operational platform of three large-scale European databases with regards to foreigners and their mobility within and towards Europe, namely Eurodac, the Schengen Information System (SIS II) and the Visa Information System (VIS). This paper tries to outline some of the problems brought about when processing big amounts of data for the purpose of European immigration and identification policies. © 2016 Association for Borderlands Studies.",,,"Tsianos, V.S.; University of Applied Sciences Kiel, Sokratesplatz 1, Germany; email: Vassilis.Tsianos@FH-Kiel.de",,"Routledge",08865655,,,,"English","J. Borderl. Stud.",Article,"Final","",Scopus,2-s2.0-84975454486
"König M.","57210705811;","The borders, they are a-changin'! the emergence of socio-digital borders in the eu",2016,"Internet Policy Review","5","1",,"","",,2,"10.14763/2016.1.403","https://www.scopus.com/inward/record.uri?eid=2-s2.0-85071255775&doi=10.14763%2f2016.1.403&partnerID=40&md5=1fe8a0b010cb1afe4b317c1d0ce0d3ff","Maastricht University, Netherlands","König, M., Maastricht University, Netherlands","Relying on big data, modern surveillance becomes increasingly influential in determining societal power relations. Lyon argues that modern surveillance always categorises people entailing social effects, what he conceptualises as social sorting. This paper assesses if patterns of social sorting can be found in the EU surveillance systems for migration Schengen Information System (SIS), Visa Information System (VIS) and EUROpean DACtylographic comparison system (EURODAC), which are planned to be merged in order to ensure maximum efficiency in surveillance. To do so, the paper analyses relevant documents referring to SIS, VIS and EURODAC. These systems have assumed the traditional border function of deciding on societal inclusion and exclusion. I argue that, to some extent, socio-digital borders are drawn along the categories established through social sorting. The paper exemplifies how social sorting relying on big data may be a disempowering surveillance practice. © 2016, Alexander von Humboldt Institute for Internet and Society. All rights reserved.","Big data; Borders; Social sorting",,"König, M.; Maastricht UniversityNetherlands",,"Alexander von Humboldt Institute for Internet and Society",21976775,,,,"English","Internet Policy Rev.",Article,"Final","All Open Access, Gold",Scopus,2-s2.0-85071255775
"Soltes D.","37662386500;","Schengen e-Border Wall supported by the latest smart High-Tech ICT, but",2016,"WMSCI 2016 - 20th World Multi-Conference on Systemics, Cybernetics and Informatics, Proceedings","1",,,"189","193",,1,,"https://www.scopus.com/inward/record.uri?eid=2-s2.0-85016769760&partnerID=40&md5=19b53b63d1532ad750ae5acc5665eaf9","Faculty of Management, Comenius University, Bratislava, 82005, Slovakia","Soltes, D., Faculty of Management, Comenius University, Bratislava, 82005, Slovakia","The paper is dealing with one of the currently most controversial issues in the EU regarding the protection of the external borders of the EU in the form of the so-called Schengen external border of the Union. On the one hand it is very difficult for the EU new member states to become a part of the Schengen border protection system as it requires a lot of effort and investments into the latest ICT technology and all various other technical but also organizational and personnel requirements but on the other hand right now we have been witnessing a real disastrous situation on the southern flank of the Schengen border where illegal immigrants especially from Africa are daily illegally entering the territory of the EU. However, by a certain paradox in many cases these illegal immigrants are entering the EU territory through the humanitarian aid to be extended to them by the EU costal border guards that on the basis of the principles of the International humanitarian law have to extend their help to these illegal immigrants in case of some necessary rescue operations from their drowning boats on the Mediterranean sea and bring them to the territory of the EU. The paper in more details will be dealing with this evident paradox between the latest ICT technology and humanitarian aspects of International humanitarian law.","CCTV; Sis - SCHENGEN information system; Smart ICT; The schengen area; The schengen external border of the eu","Closed circuit television systems; Cybernetics; Border guards; Border protection; Illegal immigrants; Mediterranean sea; New Member States; Rescue operations; Smart ICT; The schengen area; Crime","Soltes, D.; Faculty of Management, Slovakia","Callaos N.C.Sanchez B.Lace N.Savoie M.Tremante A.","International Institute of Informatics and Systemics, IIIS",,9781941763476,,,"English","WMSCI - World Multi-Conf. Syst., Cybern. Informatics, Proc.",Conference Paper,"Final","",Scopus,2-s2.0-85016769760
"Bianco S.L.","57194073463;","Deliberating justice policy in the European Union: A discursive perspective on day-to-day decision-making in European Union’s criminal justice cooperation",2016,"European Politics and Society","17","2",,"150","165",,1,"10.1080/23745118.2016.1120992","https://www.scopus.com/inward/record.uri?eid=2-s2.0-84968645199&doi=10.1080%2f23745118.2016.1120992&partnerID=40&md5=d46052aeff9963779a4af4f62592a368","Faculty of Public Management, Law and Security, The Hague University, The Hague, Netherlands","Bianco, S.L., Faculty of Public Management, Law and Security, The Hague University, The Hague, Netherlands","This paper argues that the adoption of new policy instruments of the European Union (EU) also emanate from everyday decision-making. Changes in EU policies are not only the consequences of ‘grand moments’ of treaty and institutional changes. In order to identify and explain changes in everyday decision-making, one should complement the traditional strategic bargaining perspective on decision-making with a constructivist view on discourse or language as sources of change. With the insights of both constructivists and communication theorists, this study focuses on the identification of conditions and occurrences of deliberation in the daily running of decision-making in the EU that allow for changes facilitating the adoption of new policy instruments. In this light a study of two cases will be presented of which each has taken place in a different institutional setting. The main analysis of this study is on the drafting process of the Framework Decision on the European Evidence Warrant of 2008. The findings of this analysis will be compared to findings of another analysis. It concerns the negotiations on the Council Decision of 2008 regarding access for consultation of the Visa Information System by law enforcement authorities. Analysis of both cases learned that in certain circumstances instances of deliberation and ensuing progress towards a more reasoned understanding actually occurred. © 2016 Taylor & Francis.","Constructivism; EU criminal justice; EU justice and home affairs; European Evidence Warrant; Visa Information System",,"Bianco, S.L.; Faculty of Public Management, Netherlands; email: s.lobianco@hhs.nl",,"Routledge",23745118,,,,"English","Eur. Pol. Soc.",Article,"Final","",Scopus,2-s2.0-84968645199
"Orrù E.","54397457300;","Surveillance and power in the EU [Sorveglianza e potere nella Unione europea]",2015,"Filosofia Politica","6","3",,"459","474",,,"10.1416/81386","https://www.scopus.com/inward/record.uri?eid=2-s2.0-84949203833&doi=10.1416%2f81386&partnerID=40&md5=6cc2569d5fc291229408f16ade6689ce","Centre for Security and Society / Husserl-Archiv, Albert-Ludwigs-Universität, Freiburg, Postfach 117, Freiburg, D-79098, Germany","Orrù, E., Centre for Security and Society / Husserl-Archiv, Albert-Ludwigs-Universität, Freiburg, Postfach 117, Freiburg, D-79098, Germany","Surveillance, understood as the collection of information about populations for supervision purposes, is a critical technique of social control. As such, it can reveal important features of the power that exercises it. The article analyses two contemporary surveillance measures in Europe: the Schengen Information System and the Directive 2006/24/EC on data retention. The analysis aims to identify the structural characteristics of the changing power of the EU and the role security plays in it. The main thesis is that security is a key element of the legitimacy claim of the expanding power of the EU. © 2015 Società editrice Il Mulino.","European Union; Legitimacy; Power; Surveillance",,"Orrù, E.; Centre for Security and Society / Husserl-Archiv, Postfach 117, Germany; email: elisa.orru@philosophie.uni-freiburg.de",,"Societa Editrice il Mulino",03947297,,,,"Italian","Filos. Polit.",Article,"Final","",Scopus,2-s2.0-84949203833
"Panourgias N.S.","8588087800;","Capital markets integration: A sociotechnical study of the development of a cross-border securities settlement system",2015,"Technological Forecasting and Social Change","99",,,"317","338",,13,"10.1016/j.techfore.2015.02.014","https://www.scopus.com/inward/record.uri?eid=2-s2.0-84947032697&doi=10.1016%2fj.techfore.2015.02.014&partnerID=40&md5=c2a586767f67111b955eceaf64294790","School of Management, University of Leicester, Leicester, LE1 7RH, United Kingdom","Panourgias, N.S., School of Management, University of Leicester, Leicester, LE1 7RH, United Kingdom","Digital information and communications technologies (ICTs) are transforming capital markets. The integration of capital markets is seen as one such area of transformation. The research presented in this article studies one integration initiative that took shape around the proposed combination of a number of key European securities marketplaces through the development of a cross-border settlement system. Taking a sociotechnical approach, the research presents the positions of the key actants identified in relation to key controversies regarding the development of the settlement system and shows how the relations between the controversies and the positions of the actants involved in them evolve. By examining the role of ICTs in the evolution of these relations, the study seeks to illuminate the complex causalities between the social and technical aspects of cross-border capital market integration. The article argues that in addition to enabling the interconnecting of an expanded set of transacting parties, ICTs bring important cognitive dimensions that enable the inspiration, planning, and foresight necessary for both developers and market participants to formulate their plans, strategies, and positions vis-à-vis the expanded and transformed marketplace arrangements. © 2015 Elsevier Inc.","CSDs; Globalisation; Integration; Marketplace; Markets; Securities; Settlement; Technology","Financial markets; Integration; Marketing; Mobile security; Technology; CSDs; Globalisation; Marketplace; Securities; Settlement; Commerce; capital market; economic integration; globalization; information and communication technology","Panourgias, N.S.; School of Management, United Kingdom; email: np220@le.ac.uk",,"Elsevier Inc.",00401625,,,,"English","Technol. Forecast. Soc. Change",Article,"Final","",Scopus,2-s2.0-84947032697
"Dijstelbloem H., Broeders D.","56159424200;17433346100;","Border surveillance, mobility management and the shaping of non-publics in Europe",2015,"European Journal of Social Theory","18","1",,"21","38",,50,"10.1177/1368431014534353","https://www.scopus.com/inward/record.uri?eid=2-s2.0-84923326662&doi=10.1177%2f1368431014534353&partnerID=40&md5=04ef1bd49ec2f5300f7330bc57f16e7f","University of Amsterdam, Netherlands; Erasmus University Rotterdam, Netherlands","Dijstelbloem, H., University of Amsterdam, Netherlands; Broeders, D., Erasmus University Rotterdam, Netherlands","Social sorting of migrants and travellers based on data stored in information systems is at the centre of border controls and mobility management in Europe. Recent literature finds that the inclusion-exclusion distinction is insufficiently equipped to do justice to the variety of classifications that is being applied. Instead, a proliferation of refined categorizations determines the outcome of visa and permit applications. This article explores the ‘administrative ecology’ in between the two extremes of inclusion and exclusion. It claims information technologies encourage the emergence of an intermediary category of ‘non-publics’ situated between the level of groups and the level of individuals. The ontological and normative status of these ‘non-publics’ will be analysed by using some key notions of Actor-Network Theory. © The Author(s) 2014.","actor-network theory; border control; migration; mobility; ontology; technology",,"Dijstelbloem, H.; Department of Philosophy, Oude Turfmarkt 141, Netherlands; email: H.O.Dijstelbloem@uva.nl",,"SAGE Publications Ltd",13684310,,,,"English","Eur. J. Soc. Theory",Article,"Final","",Scopus,2-s2.0-84923326662
"Pedersen M.J.","56939928900;","The intimate relationship between security, effectiveness, and legitimacy: a new look at the Schengen compensatory measures",2015,"European Security","24","4",,"541","559",,3,"10.1080/09662839.2015.1014808","https://www.scopus.com/inward/record.uri?eid=2-s2.0-85050001116&doi=10.1080%2f09662839.2015.1014808&partnerID=40&md5=ea5dcdbde7a4c39a8b66d0ac20601b1c","Department of Political Science, University of Copenhagen, Copenhagen, Denmark","Pedersen, M.J., Department of Political Science, University of Copenhagen, Copenhagen, Denmark","The so-called Schengen compensatory measures such as the Schengen Information System (SIS) or the European Dactylographic System (Eurodac) have been the centre of much attention. However, the research on these security measures has focused almost solely on their effect on liberty, human rights, and the like. Not much attention has been given to the actual effectiveness of the security remedies taken in the European Union (EU) to compensate for the abolition of border controls, despite effectiveness being an obvious source of legitimacy in the realm of security. This article takes a first step in the direction of correcting this neglect and develops the foundations for an analytical framework focusing on effectiveness and legitimacy. The framework is illustrated through a minor analysis of the legal and institutional set-up of SIS and Eurodac as examples pointing to sources of ineffectiveness in the very set-up of the databases. © 2015 Taylor & Francis.","effectiveness; Eurodac; European Union; legitimacy; output; security; SIS",,"Pedersen, M.J.; Department of Political Science, Denmark; email: mjp@ifs.ku.dk",,"Taylor and Francis Ltd.",09662839,,,,"English","Eur. Secur.",Article,"Final","",Scopus,2-s2.0-85050001116
"Pirinen R.","36617552900;","Studies of integration readiness levels: Case shared maritime situational awareness system",2014,"Proceedings - 2014 IEEE Joint Intelligence and Security Informatics Conference, JISIC 2014",,,"6975575","212","215",,5,"10.1109/JISIC.2014.79","https://www.scopus.com/inward/record.uri?eid=2-s2.0-84920261461&doi=10.1109%2fJISIC.2014.79&partnerID=40&md5=6c7f930350c331c5505a5a8ce1ea0317","Laurea University of Applied Sciences, Espoo, Finland","Pirinen, R., Laurea University of Applied Sciences, Espoo, Finland","The research question of this study is: How Integration Readiness Level (IRL) metrics can be understood and realized in the domain of border control information systems. The study address to the IRL metrics and their definition, criteria, references, and questionnaires for validation of border control information systems in case of the shared maritime situational awareness system. The target of study is in improvements of ways for acceptance, operational validation, risk assessment, and development of sharing mechanisms and integration of information systems and border control information interactions and collaboration concepts in Finnish national and European border control domains. © 2014 IEEE.","integration; integration readiness levels; maturity; pre-operational validation; situational awareness","Bioinformatics; Information systems; Information use; Risk assessment; Surveys; Border control; Integration readiness; maturity; Operational validation; Research questions; Sharing mechanism; Situational awareness; Situational awareness systems; Integration","Pirinen, R.; Laurea University of Applied SciencesFinland",,"Institute of Electrical and Electronics Engineers Inc.",,9781479963645,,,"English","Proc. - IEEE Jt. Intell. Secur. Informatics Conf., JISIC",Conference Paper,"Final","",Scopus,2-s2.0-84920261461
"Li G., Yang B., Busch C.","55871431000;7404472502;7101767185;","A score-level fusion fingerprint indexing approach based on minutiae vicinity and minutia cylinder-code",2014,"2nd International Workshop on Biometrics and Forensics, IWBF 2014",,,"6914238","","",,15,"10.1109/IWBF.2014.6914238","https://www.scopus.com/inward/record.uri?eid=2-s2.0-84934324022&doi=10.1109%2fIWBF.2014.6914238&partnerID=40&md5=11024d5867d69874a8a0309f1ec954ec","Norwegian Information Security Laboratory, Gjøvik University College, Norway","Li, G., Norwegian Information Security Laboratory, Gjøvik University College, Norway; Yang, B., Norwegian Information Security Laboratory, Gjøvik University College, Norway; Busch, C., Norwegian Information Security Laboratory, Gjøvik University College, Norway","Due to the uniqueness and permanence properties of the biometric fingerprint characteristic, large scale in border control and governmental applications such as the Visa Information System (VIS) in Europe, US-VISIT / IDENT system in the USA and the Aadhaar project in India are based on fingerprint recognition. These systems generally contain millions of fingerprint samples. In order to improve the efficiency in seeking for suitable candidate reference data in such large-scale databases, studying indexing techniques for fingerprints is desirable. In this paper, we design a new indexing method using the features extracted from minutia details including location, direction and ridge information. Then a score-level fusion indexing approach is proposed by combing this new method with the minutia cylinder-code (MCC) indexing method. The results demonstrate the improvement of the proposed approach based on experiments on several public fingerprint databases. © 2014 IEEE.","biometric database; fingerprint indexing; minutia cylinder-code; minutiae vicinity","Biometrics; Codes (symbols); Cylinders (shapes); Database systems; Biometric database; Fingerprint indexing; Fingerprint Recognition; Governmental applications; Large-scale database; Minutia cylinder codes; minutiae vicinity; Visa information systems; Indexing (of information)",,,"Institute of Electrical and Electronics Engineers Inc.",,9781479943708,,,"English","Int. Workshop Biom. Forensics, IWBF",Conference Paper,"Final","",Scopus,2-s2.0-84934324022
